tool_id,name,url,language,domain_covered,formulas_used,sources_cited,methodology,open_closed,license,last_update,strengths,weaknesses,discrepancies,legal_reuse,independent_validation,differential_value
T001,PvPoke,https://github.com/PvPoke/pvpoke,Inglés,PvP (Trainer Battles/Rankings/Simulación),Turns/CPM/Stat Product/Damage,Game Master/Comunidad,Simulación de turnos con heurísticas de cebo,Abierto,MIT,Continuo (Cada temporada de GBL),La simulación de combate y cálculo de IVs para PvP es impecable y rápida,Falta localización (i18n),Curva de aprendizaje empinada,No hay discrepancia conocida; es el estándar de facto,Reutilizable (MIT),Sí (Se puede contrastar el código JS),Pogo-lab añade i18n real en español/portugués y conecta PvP con análisis de historial de intercambios.
T002,Poké Genie,https://pokegenie.net/,Multilingüe (Incluye Español),IV scanning/Appraisal/Raid lobby/PvE Counters,CP/HP/Damage PvE aproximado,Niantic (Game Master),Escaneo OCR de pantalla y coincidencia difusa,Cerrado,Propietaria,Continuo,UX de captura de pantalla y sistema de lobbies de incursiones automáticos,Matemáticas opacas,No explica supuestos ni muestra fórmulas abiertas,Algunas estimaciones de daño PvE difieren de Gamepress por aproximaciones en ciclos de energía,Referenciable únicamente,No (No hay código público),Pogo-lab ofrece transparencia matemática total, explicaciones en texto claro y no requiere escaneo intrusivo.
T003,GamePress DPS/TDO Spreadsheet,https://gamepress.gg/pokemongo/comprehensive-dps-tdo-spreadsheet,Inglés,PvE Combat (DPS/TDO/Raids),Weave DPS/Cycle DPS/ER,Game Master/Comunidad (Gorefiend),Cálculo matricial de daño por ciclo de energía y barra,Cerrado (Motor de cálculo); Abierto (Artículos),Propietaria,Baja (Actualizaciones intermitentes),La fórmula ER (Equivalent Rating) es excelente y refleja el combate PvE mejor que el DPS puro,Interfaz web antigua y lenta; anuncios invasivos; código de cálculo no documentado,Los breakpoints a veces fallan por decimales si no se considera el delay de red (0.5s),Referenciable únicamente,Parcialmente (A través de réplicas comunitarias en Python),Pogo-lab automatiza estos cálculos en una interfaz limpia, veloz, sin anuncios invasivos y con datos abiertos.
T004,Calcy IV,https://play.google.com/store/apps/details?id=tesmath.calcy,Inglés/Alemán,Appraisal de IV/PvP rank/Costos de mejora,CP/HP/Stat Product,Comunidad,OCR en tiempo real sobre pantalla de Android,Cerrado,Propietaria,Continuo,Configuración avanzada para usuarios hardcore y escaneo en tiempo real de IVs de encuentros de captura,Exclusivo de Android; UX muy compleja y cargada,Ninguna de consideración matemática,Referenciable únicamente,No,Pogo-lab provee una herramienta web universal que funciona igual en iOS, Android y PC sin instalar nada.
T005,The Silph Road (Archived Web),https://web.archive.org/web/thesilphroad.com,Inglés,Investigaciones de tasas (Shiny/Huevos/Lucky/Captura),Intervalos de confianza/Fórmula de captura/Uniformidad,Experimentos con n grande,Ciencia de datos tradicional (muestreo y estimación bayesiana),Cerrado (Web); Abierto (Datos crudos en reddit),Creative Commons,Archivado (Mediados de 2023),Metodología científica ejemplar y honestidad en el reporte de datos,No hay herramientas interactivas modernas; datos desactualizados tras su cierre,Ratios de shiny basales se han mantenido pero eventos nuevos no están cubiertos,Reutilizable (CC),Sí (Los datos crudos y reportes están publicados),Pogo-lab hereda el rigor científico de la Silph Road pero con herramientas activas, datos vigentes y software libre.
T006,GoBattleLog,https://gobattlelog.com/,Inglés,Seguimiento de batallas PvP y tendencias de meta,Frecuencias/Estadística descriptiva simple,Datos ingresados por el usuario,Conteo y agregación de Pokémon en el Lead y Backline,Cerrado,Propietaria,Semanal,Excelente para rastrear qué se juega hoy en tu rango de GBL,Requiere ingreso manual de datos o pago; no tiene automatizaciones de scraping legales,Ninguna,Referenciable únicamente,No,Pogo-lab integra inferencia estadística para validar si las tendencias observadas por el jugador son significativas.
